{
  "format": "iluboard",
  "version": 1,
  "meta": {
    "title": "Demo Game",
    "id_prefix": "B",
    "updated": "2026-09-28"
  },
  "columns": ["idea", "todo", "doing", "done", "dropped"],
  "cards": [
    {
      "id": "B12",
      "title": "Фоторежим с фильтрами",
      "column": "idea",
      "order": 0,
      "priority": "P3",
      "size": "M",
      "owner": "code",
      "tags": ["фича"],
      "updated": "2026-09-20",
      "updated_by": "human"
    },
    {
      "id": "B14",
      "title": "Процедурные облака над картой мира",
      "column": "idea",
      "order": 1,
      "priority": "P2",
      "size": "L",
      "owner": "max",
      "goal": "3c",
      "notes": "Посмотреть Volumetric Clouds в UE, сравнить стоимость на Steam Deck",
      "tags": ["арт", "тех"],
      "updated": "2026-09-27",
      "updated_by": "agent"
    },
    {
      "id": "B9",
      "title": "Черновик диалогов пролога",
      "column": "todo",
      "order": 0,
      "priority": "P1",
      "size": "M",
      "owner": "narrative",
      "goal": "3b",
      "done_when": "Сцена читается от начала до конца, продюсер утвердил тон",
      "tags": ["нарратив"],
      "due": "2026-10-05",
      "updated": "2026-09-26",
      "updated_by": "agent"
    },
    {
      "id": "B10",
      "title": "Блокаут второй локации",
      "column": "todo",
      "order": 1,
      "priority": "P1",
      "size": "L",
      "owner": "design",
      "goal": "3b",
      "done_when": "Проходится без дыр, есть точки интереса и маршрут",
      "notes": "Референсы в Studio/refs/location2",
      "tags": ["левел-дизайн"],
      "due": "2026-10-10",
      "updated": "2026-09-26",
      "updated_by": "agent"
    },
    {
      "id": "B11",
      "title": "Сохранение прогресса в слот",
      "column": "todo",
      "order": 2,
      "priority": "P2",
      "size": "M",
      "owner": "code",
      "goal": "3c",
      "done_when": "Сейв/лоад переживает перезапуск, покрыт автотестом",
      "tags": ["тех"],
      "updated": "2026-09-25",
      "updated_by": "human"
    },
    {
      "id": "B8",
      "title": "Тест пайплайна: ковш → Substance без high-poly",
      "column": "doing",
      "order": 0,
      "priority": "P0",
      "size": "M",
      "owner": "max",
      "goal": "3b",
      "done_when": "Макс посмотрел и сказал да/нет",
      "notes": "Результат — решение в Studio/decisions.md",
      "tags": ["арт"],
      "due": "2026-10-12",
      "updated": "2026-09-28",
      "updated_by": "agent"
    },
    {
      "id": "B7",
      "title": "Камера от третьего лица: коллизии со стенами",
      "column": "doing",
      "order": 1,
      "priority": "P1",
      "size": "S",
      "owner": "code",
      "goal": "3a",
      "done_when": "Камера не проходит сквозь геометрию в тестовом уровне",
      "tags": ["тех"],
      "due": "2026-09-30",
      "updated": "2026-09-24",
      "updated_by": "human"
    },
    {
      "id": "B5",
      "title": "Настроить сборку в CI",
      "column": "done",
      "order": 0,
      "priority": "P1",
      "size": "M",
      "owner": "code",
      "goal": "3a",
      "done_when": "Ночная сборка кладёт архив в релизы",
      "tags": ["тех"],
      "updated": "2026-09-22",
      "updated_by": "human"
    },
    {
      "id": "B4",
      "title": "Мудборд главного героя",
      "column": "done",
      "order": 1,
      "priority": "P2",
      "size": "S",
      "owner": "max",
      "goal": "3a",
      "done_when": "Доска с 20+ референсами согласована",
      "tags": ["арт"],
      "updated": "2026-09-18",
      "updated_by": "human"
    },
    {
      "id": "B3",
      "title": "Мультиплеер на двоих",
      "column": "dropped",
      "order": 0,
      "priority": "P3",
      "size": "XL",
      "owner": "producer",
      "notes": "Отложено после вехи 3: не влезает в бюджет",
      "updated": "2026-09-15",
      "updated_by": "human"
    }
  ]
}
